{"contractVersion":"1.0.0","evidenceVersion":"1.0.0","auditId":"97d6b2c7-03b9-4530-8ea7-16557502c638","normalizedRequest":{"targetUrl":"https://rebootbusinesscoaching.com/","businessName":"Rebootbusinesscoaching","market":"Canada","language":"en-CA","primaryGoal":"Generate qualified enquiries","services":["4-Week Reboot Series","Group Coaching","Individual Coaching","One-Page Business Planning"],"competitors":["https://ginakeeping.ca/","https://traceyjazmin.com/","https://clarityofgoalsandvision.com/"]},"sources":{"website":{"source":"dataforseo-onpage","status":"PARTIAL","collectedAt":"2026-08-23T03:09:47.498Z","provider":"DataForSEO","adapterVersion":"1.2.0","startedAt":"2026-08-23T03:09:04.860Z","completedAt":"2026-08-23T03:09:47.498Z","retryCount":0,"coverage":{"requested":500,"completed":7,"failed":493},"limitations":["Microdata retrieval returned code 40501: \"Invalid Field: 'url'.\".","Page body content, link arrays, image arrays, CTAs, forms, and structured data are not extracted by the DataForSEO On-Page pages endpoint. Content-dependent signals (trust, CTAs, forms, schemas) are reported as unavailable rather than confirmed absent."],"requestId":"08230309-1281-0216-0000-1ebd25f37b7e","artifactRef":{"key":"tenants/omnipressence/clients/rebootbusinesscoaching.com-rebootbusinesscoaching/audits/97d6b2c7-03b9-4530-8ea7-16557502c638/raw/dataforseo-onpage-b088a9bd-b517-46d8-8d6c-e9f97dd828f4.json","sha256":"c9c687f43887cec305cfe6871ce9df0cded1eddd98018c1f20ab02ef6d287b35","bytes":388198}},"performance":{"source":"pagespeed","status":"AVAILABLE","collectedAt":"2026-08-23T03:10:13.470Z","provider":"pagespeed-insights","adapterVersion":"1.1.0","startedAt":"2026-08-23T03:09:48.256Z","completedAt":"2026-08-23T03:10:13.470Z","retryCount":0,"coverage":{"requested":2,"completed":2,"failed":0},"limitations":["Screenshot persistence failed for mobile: runId is required for screenshot persistence","Screenshot persistence failed for desktop: runId is required for screenshot persistence","CrUX PHONE failed (403)","CrUX DESKTOP failed (403)"],"artifactRef":{"key":"tenants/omnipressence/clients/rebootbusinesscoaching.com-rebootbusinesscoaching/audits/97d6b2c7-03b9-4530-8ea7-16557502c638/raw/pagespeed-b088a9bd-b517-46d8-8d6c-e9f97dd828f4.json","sha256":"2a6ad0fa501344ac8aec61b2a33f1bd850b1b85b31079be780b8536d9e702cda","bytes":926}},"competitors":{"source":"dataforseo-serp","status":"FAILED","collectedAt":"2026-08-23T03:13:20.061Z"},"backlinks":{"source":"backlinks","status":"AVAILABLE","collectedAt":"2026-08-23T03:13:22.041Z","provider":"DataForSEO","adapterVersion":"1.0.0","limitations":[],"artifactRef":{"key":"tenants/omnipressence/clients/rebootbusinesscoaching.com-rebootbusinesscoaching/audits/97d6b2c7-03b9-4530-8ea7-16557502c638/raw/backlinks-b088a9bd-b517-46d8-8d6c-e9f97dd828f4.json","sha256":"01bde8d7d2438c867de7bda5dc5a3a81a62d025d08ba42d8847e428b112fd71b","bytes":326}}},"limitations":["Microdata retrieval returned code 40501: \"Invalid Field: 'url'.\".","Page body content, link arrays, image arrays, CTAs, forms, and structured data are not extracted by the DataForSEO On-Page pages endpoint. Content-dependent signals (trust, CTAs, forms, schemas) are reported as unavailable rather than confirmed absent.","Screenshot persistence failed for mobile: runId is required for screenshot persistence","Screenshot persistence failed for desktop: runId is required for screenshot persistence","CrUX PHONE failed (403)","CrUX DESKTOP failed (403)","Source execution failed: Source execution timed out"],"artifactReferences":[{"source":"dataforseo-onpage","key":"tenants/omnipressence/clients/rebootbusinesscoaching.com-rebootbusinesscoaching/audits/97d6b2c7-03b9-4530-8ea7-16557502c638/raw/dataforseo-onpage-b088a9bd-b517-46d8-8d6c-e9f97dd828f4.json","sha256":"c9c687f43887cec305cfe6871ce9df0cded1eddd98018c1f20ab02ef6d287b35","bytes":388198,"contentType":"application/json"},{"source":"pagespeed","key":"tenants/omnipressence/clients/rebootbusinesscoaching.com-rebootbusinesscoaching/audits/97d6b2c7-03b9-4530-8ea7-16557502c638/raw/pagespeed-b088a9bd-b517-46d8-8d6c-e9f97dd828f4.json","sha256":"2a6ad0fa501344ac8aec61b2a33f1bd850b1b85b31079be780b8536d9e702cda","bytes":926,"contentType":"application/json"},{"source":"backlinks","key":"tenants/omnipressence/clients/rebootbusinesscoaching.com-rebootbusinesscoaching/audits/97d6b2c7-03b9-4530-8ea7-16557502c638/raw/backlinks-b088a9bd-b517-46d8-8d6c-e9f97dd828f4.json","sha256":"01bde8d7d2438c867de7bda5dc5a3a81a62d025d08ba42d8847e428b112fd71b","bytes":326,"contentType":"application/json"}],"adapterVersions":{"dataforseo-onpage":"1.2.0","pagespeed":"1.1.0","dataforseo-serp":"1.1.0","backlinks":"1.0.0"},"createdAt":"2026-08-23T03:13:22.041Z"}