{"contractVersion":"1.0.0","evidenceVersion":"1.0.0","auditId":"9714c206-8ed3-4686-8fe2-ceeca0ca0f82","normalizedRequest":{"targetUrl":"https://www.tbkcreative.com/","businessName":"Tbkcreative","market":"London, Ontario, Canada","language":"en-CA","primaryGoal":"Generate qualified enquiries","services":["Custom Websites","Digital Marketing","SEO","Branding","Custom Software"],"competitors":["https://red-rhino.com","https://www.northern.co","https://www.zoomedia.ca"]},"sources":{"website":{"source":"dataforseo-onpage","status":"PARTIAL","collectedAt":"2026-08-27T22:29:18.346Z","provider":"DataForSEO","adapterVersion":"1.4.1","startedAt":"2026-08-27T22:17:51.261Z","completedAt":"2026-08-27T22:29:18.346Z","retryCount":0,"coverage":{"requested":250,"completed":250,"failed":0},"limitations":["Crawl stopped: limit_exceeded (limit: 250, crawled: 250, queued: 0)","Page ceiling reached after 250 pages crawled"],"requestId":"08272217-1281-0216-0000-ec75157b5013","artifactRef":{"key":"tenants/omnipressence/clients/www.tbkcreative.com-tbkcreative/audits/9714c206-8ed3-4686-8fe2-ceeca0ca0f82/raw/dataforseo-onpage-b40b829a-9770-43bb-bb5b-755b53947698.json","sha256":"47668a92e338759dd15206f841980a31aab3a594d792945187cbdd2da3cbef0e","bytes":11573873}},"performance":{"source":"pagespeed","status":"AVAILABLE","collectedAt":"2026-08-27T22:30:36.492Z","provider":"pagespeed-insights","adapterVersion":"1.1.0","startedAt":"2026-08-27T22:29:20.494Z","completedAt":"2026-08-27T22:30:36.492Z","retryCount":0,"coverage":{"requested":2,"completed":2,"failed":0},"limitations":["Screenshot persistence failed for mobile: runId is required for screenshot persistence","Screenshot persistence failed for desktop: runId is required for screenshot persistence","CrUX PHONE failed (403)","CrUX DESKTOP failed (403)"],"artifactRef":{"key":"tenants/omnipressence/clients/www.tbkcreative.com-tbkcreative/audits/9714c206-8ed3-4686-8fe2-ceeca0ca0f82/raw/pagespeed-b40b829a-9770-43bb-bb5b-755b53947698.json","sha256":"a1f946aa823dde1c6b942267651e05e8b178edb9c55f1a95308b5a4e8e1eab5b","bytes":945}},"competitors":{"source":"dataforseo-serp","status":"PARTIAL","collectedAt":"2026-08-27T22:31:18.127Z"},"backlinks":{"source":"backlinks","status":"AVAILABLE","collectedAt":"2026-08-27T22:31:21.941Z","provider":"DataForSEO","adapterVersion":"1.0.0","limitations":[],"artifactRef":{"key":"tenants/omnipressence/clients/www.tbkcreative.com-tbkcreative/audits/9714c206-8ed3-4686-8fe2-ceeca0ca0f82/raw/backlinks-b40b829a-9770-43bb-bb5b-755b53947698.json","sha256":"40c14248c0e7cd3aea0f6ad070d029e7daa42c050197f402ed50528eafa7ee44","bytes":1273}}},"limitations":["Crawl stopped: limit_exceeded (limit: 250, crawled: 250, queued: 0)","Page ceiling reached after 250 pages crawled","Screenshot persistence failed for mobile: runId is required for screenshot persistence","Screenshot persistence failed for desktop: runId is required for screenshot persistence","CrUX PHONE failed (403)","CrUX DESKTOP failed (403)","Supplied competitor crawl failed for https://www.northern.co: no usable 2xx/3xx HTML evidence returned"],"artifactReferences":[{"source":"dataforseo-onpage","key":"tenants/omnipressence/clients/www.tbkcreative.com-tbkcreative/audits/9714c206-8ed3-4686-8fe2-ceeca0ca0f82/raw/dataforseo-onpage-b40b829a-9770-43bb-bb5b-755b53947698.json","sha256":"47668a92e338759dd15206f841980a31aab3a594d792945187cbdd2da3cbef0e","bytes":11573873,"contentType":"application/json"},{"source":"pagespeed","key":"tenants/omnipressence/clients/www.tbkcreative.com-tbkcreative/audits/9714c206-8ed3-4686-8fe2-ceeca0ca0f82/raw/pagespeed-b40b829a-9770-43bb-bb5b-755b53947698.json","sha256":"a1f946aa823dde1c6b942267651e05e8b178edb9c55f1a95308b5a4e8e1eab5b","bytes":945,"contentType":"application/json"},{"source":"dataforseo-serp","key":"tenants/omnipressence/clients/www.tbkcreative.com-tbkcreative/audits/9714c206-8ed3-4686-8fe2-ceeca0ca0f82/raw/dataforseo-serp-b40b829a-9770-43bb-bb5b-755b53947698.json","sha256":"813fc0509e6a514ea3f21f2f3dff9d2dd449a2426efc5cdd0a6fcdcc0587925e","bytes":60572,"contentType":"application/json"},{"source":"backlinks","key":"tenants/omnipressence/clients/www.tbkcreative.com-tbkcreative/audits/9714c206-8ed3-4686-8fe2-ceeca0ca0f82/raw/backlinks-b40b829a-9770-43bb-bb5b-755b53947698.json","sha256":"40c14248c0e7cd3aea0f6ad070d029e7daa42c050197f402ed50528eafa7ee44","bytes":1273,"contentType":"application/json"}],"adapterVersions":{"dataforseo-onpage":"1.4.1","pagespeed":"1.1.0","dataforseo-serp":"1.2.0","backlinks":"1.0.0"},"createdAt":"2026-08-27T22:31:21.941Z"}