{
  "contractVersion": "1.0.0",
  "evidenceVersion": "1.0.0",
  "auditId": "a1b2c3d4-e5f6-7890-abcd-ef1234567890",
  "normalizedRequest": {
    "targetUrl": "https://www.oakvillefamilydental.ca",
    "businessName": "Oakville Family Dental",
    "market": "Oakville, Ontario",
    "language": "en-CA",
    "primaryGoal": "Generate qualified patient enquiries",
    "services": ["General Dentistry", "Cosmetic Dentistry"],
    "competitors": ["https://www.oakvilledentalarts.ca"]
  },
  "sources": {
    "website": {
      "source": "dataforseo-onpage",
      "provider": "DataForSEO",
      "adapterVersion": "1.1.0",
      "status": "AVAILABLE",
      "startedAt": "2026-08-04T14:00:00.000Z",
      "completedAt": "2026-08-04T14:05:30.000Z",
      "requestId": "task-abc123",
      "retryCount": 0,
      "coverage": { "requested": 20, "completed": 20, "failed": 0 },
      "artifactRef": {
        "key": "tenants/tenant-001/.../raw/dataforseo-onpage/task-abc123.json",
        "sha256": "e3b0c44298fc1c149afbf4c8996fb92427ae41e4649b934ca495991b7852b855",
        "bytes": 24576
      },
      "limitations": [],
      "collectedAt": "2026-08-04T14:05:30.000Z"
    },
    "performance": {
      "source": "pagespeed",
      "provider": "Google",
      "adapterVersion": "1.0.0",
      "status": "AVAILABLE",
      "startedAt": "2026-08-04T14:05:30.000Z",
      "completedAt": "2026-08-04T14:05:45.000Z",
      "requestId": "",
      "retryCount": 0,
      "coverage": { "requested": 2, "completed": 2, "failed": 0 },
      "artifactRef": {
        "key": "tenants/tenant-001/.../raw/pagespeed/exec-001.json",
        "sha256": "a1b2c3d4e5f67890abcdef1234567890abcdef1234567890abcdef1234567890",
        "bytes": 8192
      },
      "limitations": [],
      "collectedAt": "2026-08-04T14:05:45.000Z"
    },
    "backlinks": {
      "source": "dataforseo-backlinks",
      "provider": "DataForSEO",
      "adapterVersion": "1.0.0",
      "status": "AVAILABLE",
      "collectedAt": "2026-08-04T14:05:50.000Z",
      "artifactRef": {
        "key": "tenants/tenant-001/.../raw/dataforseo-backlinks/exec-001.json",
        "sha256": "872181ae3bbc4065586a78178cfe86612eab434529dbd31c6816462ebe32989c",
        "bytes": 4096
      },
      "limitations": []
    },
    "ga4": {
      "source": "ga4",
      "provider": "Google",
      "adapterVersion": "1.0.0",
      "status": "AVAILABLE",
      "collectedAt": "2026-08-04T14:06:00.000Z",
      "propertyId": "123456789",
      "artifactRef": {
        "key": "tenants/tenant-001/.../raw/ga4/exec-001.json",
        "sha256": "f23a8d868335ad3dea91c109a41e89262441736742f48ad3dc330da63a960010",
        "bytes": 2048
      },
      "limitations": []
    },
    "gsc": {
      "source": "gsc",
      "provider": "Google",
      "adapterVersion": "1.0.0",
      "status": "NOT_CONNECTED",
      "collectedAt": "2026-08-04T14:06:00.000Z",
      "siteUrl": "https://www.oakvillefamilydental.ca",
      "limitations": ["GSC property not connected"]
    }
  },
  "limitations": [],
  "artifactReferences": [
    { "source": "dataforseo-onpage", "key": "tenants/.../raw/dataforseo-onpage/task-abc123.json", "sha256": "e3b0c44298fc1c149afbf4c8996fb92427ae41e4649b934ca495991b7852b855", "bytes": 24576, "contentType": "application/json" },
    { "source": "pagespeed", "key": "tenants/.../raw/pagespeed/exec-001.json", "sha256": "a1b2c3d4e5f67890abcdef1234567890abcdef1234567890abcdef1234567890", "bytes": 8192, "contentType": "application/json" }
  ],
  "adapterVersions": {
    "dataforseo-onpage": "1.1.0",
    "pagespeed": "1.0.0",
    "dataforseo-backlinks": "1.0.0",
    "ga4": "1.0.0"
  },
  "createdAt": "2026-08-04T14:06:01.000Z"
}
